{
  "$schema": "https://json-schema.org/draft-07/schema#",
  "type": "object",
  "title": "Ticket",
  "properties": {
    "id":         {"type": "string"},
    "number":     {"type": "integer"},
    "title":      {"type": "string"},
    "body":       {"type": "string"},
    "state":      {"type": "string", "enum": ["open", "closed"]},
    "author":     {"type": "string"},
    "labels":     {"type": "array", "items": {"type": "string"}},
    "comments":   {"type": "array", "items": {"$ref": "comment.json"}},
    "created_at": {"type": "string"},
    "closed_at":  {"type": "string"}
  },
  "required": ["id", "number", "title", "body", "state", "author", "labels", "comments", "created_at"]
}
