{
  "id": "t-0192",
  "number": 192,
  "title": "代金券怎么用？",
  "body": "收到 100 元券，想约老师一对一，可以直接指定对接人吗？",
  "state": "closed",
  "author": "黄亮",
  "labels": ["faq"],
  "comments": [
    {
      "author": "赵子奕",
      "body": "券用于一对一沟通，群内沟通免费。预约价格与职级对应，见价目表。",
      "created_at": "2026-09-01T17:14:00+08:00"
    },
    {
      "author": "ai",
      "body": "参考 Solution #voucher-usage：挣券渠道为课堂实训任务（100 券/个）与众包（1000 元/任务）。",
      "created_at": "2026-09-01T17:20:00+08:00"
    }
  ],
  "created_at": "2026-09-01T15:04:00+08:00",
  "closed_at": "2026-09-01T17:16:00+08:00"
}
